<!ELEMENT emails (email*)>
<!ELEMENT email (para*, cc*, cco*, asunto, texto, adjunto)*>
<!ELEMENT para (#PCDATA)>
<!ELEMENT cc (#PCDATA)>
<!ELEMENT cco (#PCDATA)>
<!ELEMENT asunto (#PCDATA)>
<!ELEMENT texto (#PCDATA)>
<!ELEMENT adjunto (nombre, mime-type, longitud)*>
<!ELEMENT nombre (#PCDATA)>
<!ELEMENT mime-type (#PCDATA)>
<!ELEMENT longitud (#PCDATA)>
